asin,text,title,location_and_date,verified,rating
B09JFFG8D7,For the refurbished priceI believe I got a great deal,I love the phone,"Reviewed in the United States on December 13, 2022",True,5.0
B09JFFG8D7,"Great Product With An Amazing Battery Life… Mag Safe Is What I Love About It…. I DoorDash, SO I Use It With The Pitaka Mag-Safe Vent Car Mount… The GPS Which I Call GOD POWERED SYSTEM On The iPhone Is Amazing And With That Pitaka Mount I Can Put My iPhone 12 Pro Max In Portrait Or Landscape GPS And I Can Keep On Rollin’!… I Love ❤️ It!🙏😍😇…. As A Matter Of Fact: I Like It, I Love It, I Want Some More Of It!😃",Apple iPhone…. 🤔…. I Have Been With iPhone Since iPhone 3GS AND I Love ❤️ It!,"Reviewed in the United States on July 23, 2022",True,5.0
B09JFFG8D7,Practically a new phone Very satisfied,Like New,"Reviewed in the United States on December 18, 2022",True,5.0
B09JFFG8D7,"The media could not be loaded.
                
            
                
            
            
        
    
    








  
  
     This phone is the real deal it came with a 98 percent battery health everything works perfectly fine thanks again",Real deal,"Reviewed in the United States 🇺🇸 on December 7, 2022",True,5.0
B09JFFG8D7,Went through the whole process of setting up just to find out it had a battery of 89% not the 90% or above like the renewed premium stated. It's also signed off being 90%. Hard to trust. I know it's only 1%.  Just felt taken. I expected more. Tried again and got one at 100% battery. Hit the jackpot right?  Wrong!!!!  This one wouldn't activate on Verizon. Spent 2 days trying and nothing. I think I might be done with renewed.,I should've trusted the reviews,"Reviewed in the United States 🇺🇸 on January 28, 2023",True,2.0
B09JFFG8D7,Works perfect,excellent,"Reviewed in the United States 🇺🇸 on December 21, 2022",True,5.0
B09JFFG8D7,"I had to return the one I received, as it had apparently sustained water damage to the charging port, and would occasionally throw up an error. It also wouldn't charge through the Lightning port, although I could have settled for only MagSafe or Qi charging. But that's not what I'm paying for when it says ""Grade A - Excellent"".",Renewed doesn't necessarily mean fully functioning,"Reviewed in the United States 🇺🇸 on February 18, 2023",True,2.0
B09JFFG8D7,Works great. Like new,Works great. Like new,"Reviewed in the United States 🇺🇸 on December 14, 2022",True,5.0
B09JFFG8D7,The battery life was 100% and it has worked well since. It is like it was new,Awesome Purchase,"Reviewed in the United States 🇺🇸 on November 18, 2022",True,5.0
B09JFFG8D7,Excelente inversión,Buenísimo,"Reviewed in the United States 🇺🇸 on December 13, 2022",True,5.0
B09JFFG8D7,"I ordered the iPhone 12 Max Pro Premium thinking I had eliminated all the problems associated with buying a used phone.  The ""Premium"" in the purchase was a promise of a cosmetically excellent iPhone with a one-year guarantee and a minimum battery health of 90%.  Well, therein lies the rub.  The exterior of the phone was excellent but upon checking the battery health I found it to be 87%.  I might have been willing to accept it, but I noticed on the inspection card that all items had been checked off including the 90% battery health, but the card had not been signed or initialed.  I started thinking about what else had not been checked so I boxed it up and sent it back.  I'll try it again because I believe that one person doesn't make or break a company.",A little disappointed,"Reviewed in the United States 🇺🇸 on October 18, 2022",True,2.0
B09JFFG8D7,"My first iPhone coming from a Galaxy 9+ and I’ve been loving it. The battery life is great, health came in at 97% and despite me being an avid social media user, it stays charged all day. It had some tiny scratches on the sides but I didn’t mind cause it was used. I got screen protectors and a few cases and I LOVE IT.",Love it,"Reviewed in the United States 🇺🇸 on June 25, 2022",True,5.0
B09JFFG8D7,"The battery capacity is 88%. There is a scratch. Not a bad phone, but at an inflated price. The seller needs to better check the phones before shipping. I decided not to return it, as it is a long process, and shipping back by dhl would cost $ 210 (the order was not made in the USA).","Not a bad phone, but at an inflated price.","Reviewed in the United States 🇺🇸 on January 21, 2023",True,2.0
B09JFFG8D7,"So I first had ordered this phone but it was only renewed, I got the phone and it was in bad shape, so I returned it. Then I came across Amazon renewed premium so I decided to give it one more shot. They promised that the batter life would be above 90% so I took a chance. I was absolutely blown away, when I got the phone all setup I viewed the battery health and it was 100%! Super happy with this phone and I saved around $250 compared to buying it brand new!",Beyond happy with this purchase,"Reviewed in the United States 🇺🇸 on March 30, 2022",True,5.0
B09JFFG8D7,"It seems like a pretty functional phone.. appears to work well in most capacities other than the battery, which is right off the bat draining very quickly with very mild usage. (Was assured to be at 90+%)(the last refurbished iPhone I bought came at 98% and after 2 years of usage is at 92%) So it’s a bit of a bummer because I’m just going to have to get the battery replaced soon. I honestly might just exchange the phone soon, just throughout writing this review the battery has drained 7%…. That is terrible in my opinion.",Battery health at 90%,"Reviewed in the United States 🇺🇸 on May 8, 2022",True,3.0
B09JFFG8D7,"Yah these guys don’t follow the renewed premium guides what so ever. I was supposed to receive a phone in like new condition. Instead what I received was super dirty in the crevices, covered with micro scratches on the side that I can see farther than arms length away. The battery is supposed to come with minimum guaranteed 90% battery health, it only came with 88%. When I put my ear to the phone to talk to people they are WHISPER quiet. I can barely hear anything and have to talk to people on speaker phone. They literally sent me a broken phone for renewed premium price and Amazon won’t refund me the difference between renewed premium and renewed pricing. I can’t just return this phone and buy a new one because all my data is on this phone now. I highly recommend don’t be cheap and get a new phone, or just have really low expectations when you buy renewed premium instead.",Pretty much got scammed by Amazon,"Reviewed in the United States 🇺🇸 on March 4, 2023",True,1.0
B09JFFG8D7,Excelente producto!,"Excelente producto,!","Reviewed in the United States 🇺🇸 on November 30, 2022",True,5.0
B09JFFG8D7,"After deciding I wanted to upgrade my phone I figured that going the “renewed” direction was the most affordable option. I must say I was very hesitant at first. Even when I got the device, the plastic on it gave the impression it was banged up and the screen possibly cracked. Luckily for me I realized it was just the plastic, and after removing the phone looked as though it came straight out the apple store. It works just as good as well. All in all so far I think it was a great purchase.",Looks and operates like BRAND NEW!,"Reviewed in the United States 🇺🇸 on February 19, 2022",True,5.0
B09JFFG8D7,Good,Good,"Reviewed in the United States 🇺🇸 on June 15, 2022",True,4.0
B09JFFG8D7,"I think all iPhones are great phones-long time user here. I specifically wanted a 12 Pro Max; tried the 13 Pro Max from Apple Store & felt it was too heavy. This model just right and has almost all same features as the new 13. Hard to find locally to purchase, and the Renewed Premium is just like a new phone. Battery maximum capacity on it is 99% and body looks flawless! Definitely worth purchasing a Renewed Premium.",Awesome Phone!,"Reviewed in the United States 🇺🇸 on March 14, 2022",True,5.0
B09JFFG8D7,"Soooo I’m originally a Samsung type a girl but my kids kept pressing me to try IPhone and I brought the 12 pro max, the phone over all is a great phone. It has face recognition for all my apps and purchases. My battery life is excellent also it will stay charged all day. The phone also came clean and with a cord and wall charger. I’ve had it little over a month and so far so good it came with a yr warranty, so I’m very pleased with this buy",Great buy,"Reviewed in the United States 🇺🇸 on February 11, 2022",True,5.0
B09JFFG8D7,everything arrives as describedthe battery at 100% lifeno bumps or scratchesall in order,everything arrives as described,"Reviewed in the United States 🇺🇸 on September 22, 2022",True,5.0
B09JFFG8D7,Great seller ! Item functions as described. Original quality iphone 12 Pro Max! Great IOS simple to navigate and use. The IOS ecosystem is good for those who prefer Apple products from ipads to Apple watch or Airpods.,Functions as described,"Reviewed in the United States 🇺🇸 on July 3, 2022",True,5.0
