asin,text,title,location_and_date,verified,rating
B09P7ZK4CJ,"Update: sometimes there will be very notable smear when moving objects in games. It's not always the case, but it's annoying whenever it appears. The situation didn't replicate itself on the original screen of my laptop, so I'll assume it's the monitor's fault.=======================================================So I bought two of these monitors to build a dual monitor setup. Long story short, as monitors, they work not badly so far, in the standard of a non-professional user. The picture was blurry at first, but then I noticed that I simply forgot to remove the plastic film on it.They worked just as great as my old ASUS monitor, or I guess so. My old one's been broken for a long time and I can't really compare them anyway. I connected one monitor with HDMI and another with a mini DP port. The mini DP-connected monitor seems to support 165 HZ, which I have no idea whether it's because individual product differences or because I connected with DP instead of HDMI.There are no major issues so far, but there are minor flaws. Not the quality, but the design. First of all, this monitor does not have a built-in speaker, instead, it has a headphone jack. This is no big issue to me since I usually prefer my headphone, but just in case you're building your own PC, you might want separate speakers. It does automatically become your default audio device and is sometimes annoying, but I guess it's not really *this* monitor's issue, but rather a general problem.The second issue is that, remember I said there's plastic film attached to the monitor when it arrives? when you remove it, the bottom of the film is... clamped on the bottom of the monitor. So when the film is removed, you will get a sheet of film that is flat on three sides, but the last side is torn in a jagged shape. Uh, I guess nobody would ever care about this?The third issue, the monitor is kinda thin. Besides the center bottom, this is a thin and big monitor. It's cool when you put it on your table, but my dual monitor setup is installed on a monitor mount. Each time I adjust the angle, I'm worried about damaging it. Not a big deal if you're using the stand included in the package.",More than I would expect,"Reviewed in the United States on March 18, 2023",True,4.0
B09P7ZK4CJ,"I really liked this monitor, high refresh rate, DP for my GPU, the only downsides I've noticed thus far is that:1. it comes default with a really dark contrast2. when I use it for extended periods of time it starts to ""flicker"" like the brightness is constantly adjusting itself3. the feet are really low on the back of the monitor meaning that the arm mount is also low, so its way out of line with my other monitor4. the buttons are less intuitive than they could be, they're put on the back in a straight line and not labeled very clearly so adjusting picture quality and color etc. is a little challenging to people who don't know which button is wereall in all great monitor would definitely buy again, but for a first time monitor I'd definitely recommend a different more versatile one",good quality and gaming performance,"Reviewed in the United States on March 22, 2023",True,4.0
B09P7ZK4CJ,"OverviewNice graphics (1440p) and refresh rate (up to 144Hz with included HDMI) for a $180 27"" curved monitor. I was skeptical because similar monitors cost around $250, but in spite of this monitor's quirks, I still think it's a good deal.Bugs encounteredThe screen flickers non-stop when both FreeSync is on and I switch out of a full screen game. Not a problem when FreeSync is off.When I leave my connected laptop on lock screen and return after several minutes, the monitor will flicker with a black screen persistently. Solved by putting my laptop on sleep mode instead.ConclusionI'm just an average gamer and YouTube watcher, so this monitor meets my needs and the screen looks great. Will consider upgrading to a 32"" curved monitor from a more reputable brand eventually, but for now this is more than satisfactory.",Nice but Buggy,"Reviewed in the United States on March 16, 2023",True,4.0
B09P7ZK4CJ,"I am incredibly pleased that i bought this monitor , Shipping was quick , I bought it during the Amazon Deal Of The Day , and got it for 23% less than it typically sells for. I am amazed at the ease of setting up, the color , and the overall build quality as well. It is attractive and easy on the eyes. Everything set up perfectly in Home built box with ASUS Z370 Pro Gamer mobo, and Windows 11 latest build  ( 22 H2 and patched this week ) Very pleased , I hope in time this year i can buy a 2nd one to make a nice console. But for now this is so incredible and is my first screen purchase since 2011.  VERY PLEASED","Bought For Photographic Editing With Large Megapixel Images , Huge Files Zoom Right Open FAST FAST","Reviewed in the United States on March 18, 2023",True,5.0
B09P7ZK4CJ,"I've had this monitor for a little while now and so far so good, I use it mostly for gaming, Competitive FPS games in particular (Valorant, Apex, etc.), I have used it for some video editing and photoshop work but I haven't color corrected this panel yet so I'm not too sure on the color preproduction on this panel. One thing that I've noticed is that white text on a dark background will occasionally have significant chromatic aberration, the way to fix this is by turning freesync on then off again in the monitor settings, also make sure your ClearType settings are correct in windows. This is the reason I gave the Picture Quality section a 4/5 star review. otherwise I'm a happy camper with my purchase.",For the price you get a lot of bang for you buck,"Reviewed in the United States on March 5, 2023",True,5.0
B09P7ZK4CJ,"Starting with the monitor itself, it's nice. I got my first one during the Black Friday Sale for a pretty good price. Once I got it hooked up with my gaming laptop, it certainly was relatively smooth. After being satisfied with it, I ordered a second one for the good old dual-display feature. But the first monitor I ordered had an awful bug where you could see annoying lines around the screen's surface. It was a different model since it had an extra USB port in the back compared to my first order. So I returned it. After getting the replacement today, I can see the new one is the same model with fewer bugs.I know it's different from the adapter since I tried both old and new screens with a cheaper and more expensive one twice. And there can't be any severe visual issues since my gaming laptop is perfect.I don't know. But what I can say overall about this product is that it's a very good Black Friday deal. It has extremely great Hz and visuals but lacks compatibility with other screens. I'm not planning on returning the newer screen just because the bugs aren't as bad. But I'll probably buy some better screens eventually.","Pretty good monitor, small bugs","Reviewed in the United States on January 4, 2023",True,4.0
B09P7ZK4CJ,"First, let me tell you that the sellers of this product are great and even worked with me over the weekend because the Amazon delivery man just threw the box on my porch leaving one of them damaged.  Since Amazon stores, packages, and delivers, please don't blame the seller if you receive a damaged product.  The monitors are great for gaming and doing my job as a software engineer.  They look very slick and perform well.  I would highly recommend the product and seller.",The monitors are great for gaming and doing my job as a software engineer.,"Reviewed in the United States on March 14, 2023",True,5.0
B09P7ZK4CJ,"Classic example of you get what you pay for. The image isn't too bad. You have to cycle through mods to find which one works best and adjust settings. Even at 165hz, this has some bad mouse ghosting. I use this primarily for work. The only time I notice the mouse ghosting is on dark backgrounds, Spotify for example. The stand is the only part that truly bugs me. I'm just typing and it wobbles around. It is not a good design, it is not stable. I'm a little concerned this thing is gonna break one day from how much it moves. So if you game with this, and hit your desk, you're in for it. My recommendation is if you want quality go for something else. In my case, I'm fine with it. I saved money and I'm really not using this for gaming so I don't have an issue with it.",Budget Monitor,"Reviewed in the United States on January 9, 2023",True,4.0
B09P7ZK4CJ,"Great product, got to me a few days late though, so don't pay extra, they'll still have it show up late","Works great, slow shipping though.","Reviewed in the United States on March 20, 2023",True,4.0
B09P7ZK4CJ,"Got it about 3 weeks ago and I’ve loved it; I think a cluster of my pixels died overnight though, it’s not on the screen and I’ve tried restarting the monitor",Works well for cheap,"Reviewed in the United States on March 13, 2023",True,4.0
B09P7ZK4CJ,"All of the features - none of the cost! Fantastic quality, thin as h³ll and 165Hz (when using DisplayPort). I couldn't ask for more out of a product that is so inexpensive. Highly recommended!","165Hz, 1ms Response Time, 3000:1 Contrast Ratio, 99% sRGB, 1800R Curve and FreeSync for under $170!","Reviewed in the United States on March 23, 2023",True,5.0
B09P7ZK4CJ,"El monitor está bien para el precio que se está pagando. No es que tiene los mejores colores pero, cumple su función para jugar o ver contenido multimedia.Ahora bien, no se lo recomendaría a personas que vayan a usarlo para trabajar diseño o arquitectura",Excelente por el precio.,"Reviewed in the United States on March 14, 2023",True,5.0
B09P7ZK4CJ,"I love this monitor.  It looks great, it sits at a couple inches off the desk, the controls are easily accessible (although hidden on the back right side of the monitor).  The downside? I forgot to check the size first, and it is a quarter of an inch too large for my desk, so I had to ...Modify... my desk.  Still.  The monitor was totally worth it.",I love this monitor.,"Reviewed in the United States on March 3, 2023",True,5.0
B09P7ZK4CJ,"It’s bright, I love how big it is. I can have two programs running on the same screen side by side. It’s exactly what I needed. No complaints so far.",Love it!,"Reviewed in the United States on March 23, 2023",True,5.0
B09P7ZK4CJ,"I genuinely wasn't expecting much out of a sub $200 1440p curved 27"" monitor, so my expectations were quite low overall.  I'm rather surprised at how nice this monitor actually is, and am seriously considering picking up two more of them to replace my other monitors in my setup.",Pleasantly surprised,"Reviewed in the United States on March 14, 2023",True,5.0
B09P7ZK4CJ,"Ultimately this monitor was bought for my 14 year old to upgrade his set up a little. That being said, for the purpose it serves and the fact that it's for a kid that doesnt care so much about anything other than it can be used for his games and it doesnt have any dead pixels. He is happy. I am happy.Now, i personally am using dual Samsung g7 odyssey 2k monitors. Curved. Oooh. So dont compare them to expensive monitors. I mean side by side to mine there are obvious differences. If you want all the bells and whistles of a premium monitor --then buy one. But, if you are looking for a decent budget monitor then, this thing isnt bad for the price tag. I also bought it on sale. So, theres that.4 stars. It is great for the purpose it serves. And my kid dont care about if it is an oled or 4k or any of that. It looks nice and it works. He is stoked.",Solid budget monitor,"Reviewed in the United States on December 20, 2022",True,4.0
B09P7ZK4CJ,Wish I could give 5 stars absolutely beautiful picture well worth the money only gripe is it has no protective film on the screen so it was delivered with a few scratches and imperfections,Absolutely great monitor/ scratches,"Reviewed in the United States on February 28, 2023",True,4.0
B09P7ZK4CJ,"The media could not be loaded.
                
            
                
            
            
        
    
    








  
  
     I needed a new gaming monitor since the one I’ve had for the past 3 years fell over and cracked. I contacted the manufacturer to purchase a screen replacement from them but they didn’t not offer any screen replacements for sale. So the hunt for a new monitor began. I initially planned on a 2k but decided to first settle for something a step up from 1080p but not exactly 2k so I went with this 1440p that I came across while browsing online. Have to say I struggled with it at first because many of the settings were grayed out and I couldn’t make any picture adjustments due to that. Turns out I had to shut off HDR mode which honestly was the best choice. I got this monitor just to play some games on my new PS5. (Had to replace the old PS5 because it gave out and Sony wouldn’t replace it unless I admitted to damaging it which I did not, it was a faulty console) and once I figured out how to properly work all of the setting’s, I fell in love with it. The picture quality as well as vibrant colors are beautiful. I’m running up to 120 FPS on games that support 120 for the PS5 at 1440p and I’m impressed. If a 1440p at 120FPS looks this great, then I can hardly wait and see what a 2k from this company looks like. I highly recommend this monitor to anyone looking for a good yet inexpensive monitor. Also, I want to point out that the customer service I received was absolutely phenomenal and some of the best I have ever received from any company. Thank you for all the support Lacie! 🤗",Love it! Customer service is phenomenal!,"Reviewed in the United States on February 23, 2023",True,5.0
B09P7ZK4CJ,One of them I purchased had a dead pixel. The ports are very limited in my opinion.,Dead pixel,"Reviewed in the United States on March 9, 2023",True,4.0
B09P7ZK4CJ,"I dont ever give a 5 star review unless everything was so perfect I'd buy the same thing if I needed it agsin. Although this monitor is worth every penny, I bought 3 and my gpu handled it like a dream. If given he chance, in hindsight, I should have probably only bought two because the field of vision is just too wide for me, but that has nothing to do with the performance of this monitor. I'm not a huge techie like I've seen some are with their reviews, all I can say is the picture is perfect. So much better than the vgi and hdmi monitors I had previously on my computer. I haven't really put it to the test with playing a game like Elden Ring yet, but I have the game, just haven't had a lot of time to play.Overall for the price, I would say this is a med to high level monitor and is great for gaming and productivity. Solid 4*'s.",Perfect for any need,"Reviewed in the United States on December 15, 2022",True,4.0
B09P7ZK4CJ,"Fast shipping even to where I am in Alaska it wasn't too bad. Box was securely packaged and there was no damage! I was making due with a thrift shop antique, so far this monitor is a major upgrade and it's definitely improved my tendency to get sore eyes from the old monitor. The only thing I wish was different would be a little more curve to the screen than it has, but it does not impact anything important for the average user. Poopie in my pants. I like to ad something stupid to my reviews so y'all know it's real and i aint professional :D","Excellent product, wish it had a little more curve.","Reviewed in the United States on February 19, 2023",True,5.0
B09P7ZK4CJ,BUT I still have not gotten the speakers in the monitors to cooperate with my docking station. I didn't buy it for the speakers though.,Overall great monitors,"Reviewed in the United States on February 26, 2023",True,4.0
B09P7ZK4CJ,"I bought two of these for work, and I could not be anymore happy with this purchase.",VERY satisfied with this purchase!,"Reviewed in the United States on March 24, 2023",True,5.0
B09P7ZK4CJ,"Very good would recommend for the price, did cut out whën ï first got it but might have been  an issue in my end.",Good,"Reviewed in the United States on February 23, 2023",True,4.0
B09P7ZK4CJ,"For $159.99 -$10 this monitor was an exceptionally good price for a high refresh rate curved gaming monitor with good brightness. It looks good, it's exactly what I was looking for, and I'm happy with it. It has an HDR mode, and works with Windows HDR, but it looks ""wrong."" The bad: no sound through any input (DP, HDMI, or aux and after 30 min of troubleshooting) not a deal breaker for me because thin monitors have bad sound to begin with, and it could be just mine. I thought it came with a couple dead pixels in the bottom right (see picture), but on closer inspection it looks like some flaw or debris on top of the panel. Again not a deal breaker because it's in an unobtrusive place and it's dark. Looks like overall QA problems with this brand, but for this price you get what you pay for. If I need another cheap monitor in a hurry I'd buy again, and I probably will pickup the 1440p one.",I'm satisfied despite flaws,"Reviewed in the United States on March 17, 2023",True,3.0
B09P7ZK4CJ,"I am incredibly picky when it comes to my setup, I didn’t know much about Crua or any of there products but let me tell you. I have had zero eye strain since I’ve purchased this monitor. Good sleek choice for a gaming monitor. Definitely a buy.",Bang for the buck,"Reviewed in the United States on March 5, 2023",True,5.0
B09P7ZK4CJ,"-EditedPurchase this asap. Just because it fits your BUDGET and it's not a bad monitor at all.It has great picture. And easy to adjust settings.And last thing just be careful. Like any monitor screen, just be careful.Not to mention. The support service is on point.I'm a happy customer 😊Recommended in my opinion 🤗",UPDATED REVIEW: Really like this,"Reviewed in the United States on February 23, 2023",True,5.0
B09P7ZK4CJ,"The monitor is very good for a 165hz 1080p panel. Some info however was left out of the description.1. 165hz can only be achieved on compatible DisplayPort cables, the ones included do not work, but amazon has very cheap ones that work great2. If the panel has a weird haze to it once installed you need to turn off HDR in the monitors controls3. HDR, no where in the products description does it mention its HDR compatibleThe panel looks great and is super responsive and for the price i think its the best on amazon currently","Great, Description is Poor","Reviewed in the United States on February 14, 2023",True,5.0
B09P7ZK4CJ,"One thing I would like to mention is the amount of ghosting that is present, this causes games to look blurry when moving angles. Another thing I noticed is the curve of the monitor, the curve is barley there its just curved enough to be barley considered a  curved monitor. in all other aspects this a a solid 8/10 monitor.",good for price,"Reviewed in the United States on February 4, 2023",True,4.0
B09P7ZK4CJ,"Bought two, and one somehow managed to die in 4 months which is 1 month after Amazon's return policy.Support on this product is terrible also. Company's phone number does not work and the support form you have to fill in gives no confirmation or anything.UPDATE: I have to take back my statement regarding the terrible support. The company contacted me via Amazon and was willing to offer a full refund for the dead monitor without me even having to ship it back. This is definitely good support from the company and is reason enough for me to trust them again.",Dead after Four Months | Updated Company Contact,"Reviewed in the United States on February 17, 2023",True,5.0
B09P7ZK4CJ,it doesn’t work because of the timings are off so  in the picture the second refresh rate is 119.99 and because it’s not actually 120 series s won’t let you play 1440 120 i think if crua releases an update fixing this then you guys can play at 1440. still 1080 120 does not look bad and the colors are nice,1440p 120hz doesn’t work on series s,"Reviewed in the United States 🇺🇸 on February 22, 2023",True,5.0
B09P7ZK4CJ,"Great screen haven't used it for gaming just office work, has a great resolution and a great bang for your buck",Great monitor,"Reviewed in the United States 🇺🇸 on March 15, 2023",True,5.0
B09P7ZK4CJ,been using for awhile now an i love it,great price,"Reviewed in the United States 🇺🇸 on March 23, 2023",True,5.0
B09P7ZK4CJ,(Updated review) 1* to 5*. I recieved a defective unit but after talking to Judy it has all been resolved. Thank you Judy. For doing your best efforts to take care of me as a customer.,Seems nice. If it worked.,"Reviewed in the United States 🇺🇸 on March 2, 2023",True,5.0
B09P7ZK4CJ,Easy to install and it is nice a clear picture.  Great monitor for the price.,Great Monitor for the Price!,"Reviewed in the United States 🇺🇸 on March 16, 2023",True,5.0
B09P7ZK4CJ,I bought this monitor and it met all my expectations except that it had a small piece in between the outside layer and the screen. I reached out to the Crua customer service and they helped me fix the problem.,Fantastic Customer Service,"Reviewed in the United States 🇺🇸 on February 27, 2023",True,5.0
B09P7ZK4CJ,Best monitor for the money!!,Very nice!!,"Reviewed in the United States 🇺🇸 on March 22, 2023",True,5.0
B09P7ZK4CJ,"The picture is good, packaged very well & easy set up.",So far so good,"Reviewed in the United States 🇺🇸 on March 18, 2023",True,5.0
B09P7ZK4CJ,"When you grab it, it feels pretty cheap pretty flimsy plastic on the back, but other than that it's great. Cheap monitor has really good graphics and really nice response time",Pretty good for the price,"Reviewed in the United States 🇺🇸 on March 3, 2023",True,5.0
B09P7ZK4CJ,My son bought this monitor for gaming and he has another beside it for other use. He's definitely into computers and technology.,"Son bought for himself,  he loves it","Reviewed in the United States 🇺🇸 on March 10, 2023",True,5.0
B09P7ZK4CJ,"Purchased to use with a ps5, great quality. Great picture, great price.",Love it,"Reviewed in the United States on March 15, 2023",True,5.0
B09P7ZK4CJ,Was very easy to set up and put together and honestly has great picture quality for the price I definately would buy another one if i needed two.,Works Amazing so far,"Reviewed in the United States on March 2, 2023",True,5.0
B09P7ZK4CJ,"Excelente pantalla, calidad y precio.. Pero llego con unas manchas muy leves en la pantalla ( solo se nota en fondos muy muy opacos).. No se si a la larga me dara problemas, pero por el momento va genial! Lo más probable es que sea un defecto de fabrica, pero por favor revisen bien los productos para sus futuras ventas.. Es un excelente producto, espero me dure mucho :D",8/10,"Reviewed in the United States on January 8, 2023",True,4.0
B09P7ZK4CJ,I don’t always write reviews but when I do I drink Dos Equis,Budget monitor,"Reviewed in the United States on March 10, 2023",True,5.0
B09P7ZK4CJ,"Still trying to figure out the color to make it more vivid, but overall great monitor. I love the curve of it, makes the screen better to see. Would highly recommend.",Great monitor,"Reviewed in the United States on February 28, 2023",True,5.0
B09P7ZK4CJ,This was a great monitor at first but after about 2 months I noticed I would get random periods in which the monitor started cycling through colors and wouldn't stop until I restarted it. Roughly 2 months after that I noticed the monitor would slowly turn grey (while working) to black then come back to the screen I was working at. The monitor looks nice but now a few months in starting to notice the issues. For all those wondering this is not a gaming monitor the refresh rate is not that fast but when I came it doesn't make a difference for me. I use it mainly for light office work.,Screen Started to Have issues,"Reviewed in the United States on March 21, 2023",True,3.0
B09P7ZK4CJ,"Was really excited to put it all together looked amazing but I realized there wasn't instructions so I searched it up then realized there wasn't screws, bottom line still haven't gotten to put it together now I gotta order a wall mount to use it but I did test the screen looked amazing bright and clear",Missing screws and instructions,"Reviewed in the United States on January 8, 2023",True,4.0
B09P7ZK4CJ,Update to my old review- the monitor is great and it being the price point is is plus 144hz 2k is stellar honestly! But due note hdr is not that great it washes out the black and other things so stick with sdr and adjust brightness and bam perfect color and working monitor I really love it,Check settings on the monitor!,"Reviewed in the United States on January 12, 2023",True,4.0
B09P7ZK4CJ,"For some people that are struggling to get this information: Yes, it's compatible with PS5. I got FullHD (MaxResolution) 120Hz on it. You just need to use the HDMI cable that came with the console and set on the FreeSync option in the settings. I didn't know but this monitor has HDR and it's compatible with PS5. I definitely recommend this monitor!",It's an excellent monitor!!,"Reviewed in the United States on February 9, 2023",True,5.0
B09P7ZK4CJ,"Great monitor, great value, simple install",Ahead of the curve,"Reviewed in the United States on March 10, 2023",True,5.0
