asin,text,title,location_and_date,verified,rating
B09P7ZK4CJ,"I received the package after a delay but it did arrive with in a week. The monitor was package very well and the cables it comes with seem to be ok. I've been using the monitor for 2 days and I think I like it. I chose this monitor due to the price mainly, but the proformace is very nice. I haven't add any issues with the refresh rates, but I also haven't pushed it very far. Just a bit of lite gaming, but allot of videos and we'd browsing. 1080p 60fps videos seem perfect. All in all, I'm pleased with my purchase. It does come with both an HDMI cable and a Display Port cable.",It's a very good monitor for the price.,"Reviewed in the United States on January 15, 2023",True,5.0
B09P7ZK4CJ,"Well finally got my monitor ill be taking one star off this not because the monitor itself, the monitor is awesome I haven’t hooked it up yet for gaming im still at work as im writing this. Im taking a star off because of the Choice of delivery services, USPS is the worse in the states i order this on the 11th the seller was nice enough to put it as a 2 day shipping and it took USPS 7 days to complete delivery (mind blown) but that probably just me being impatient. But other then that i love the fact it came to me safe and not broken. Cant wait to play in 165hz finally.Update:So this monitor was worth it over all clear pictures not one messed up or dead pixel i can find and really easy to set up and coming from a 60hz monitor man oh man can i see frames per second on 165hz. this was a awesome buy for my gaming set up could not be more happy, aim training and playing cod have been much easier for my eyes now that i have this monitor. Once they have more on the market i will be buying two more as it feels weird that i have one 165hz and two 60hz on the side but hey gotta do wat you gotta do. Have a blessed day who ever reads this.P.s i took a star bc of USPS and there sucky attempt to deliver my package witch was this monitor, now i giving it back just bc i love this monitor so thank you seller.",Only time can tell And time told me to tell you to buy this.,"Reviewed in the United States on November 18, 2022",True,5.0
B09P7ZK4CJ,i would recommend good for when your on a budget,love it so far,"Reviewed in the United States on March 6, 2023",True,5.0
B09P7ZK4CJ,Calidad de colores y claridad de letras pequeñas.  buena resolución.,Colores correctos y buen tamaño de pantalla,"Reviewed in the United States on March 6, 2023",True,5.0
B09P7ZK4CJ,"Like the headline says, good monitor but one of the pixels on the screen died within the first month. Other than that it's a decent all-around monitor.",Good monitor but one of the pixels on the screen died within the first month.,"Reviewed in the United States on January 18, 2023",True,4.0
B09P7ZK4CJ,"Simple set up, simple plug in and amazing graphics, she loves to play halo on it!",Amazing.,"Reviewed in the United States on February 28, 2023",True,5.0
B09P7ZK4CJ,"I love these monitors, all 3 are set to 1440 @ 144hz refresh rate. It's awesome, smooth and the image quality is top notch. Highly recommended, I bought 3 so haha.",LOVE THEM!!,"Reviewed in the United States on February 21, 2023",True,5.0
B09P7ZK4CJ,Great monitor highly recommend you buy while on sale,Love The Monitor Just Wish Speakers Worked,"Reviewed in the United States on March 4, 2023",True,5.0
B09P7ZK4CJ,"I purchased this monitor for the purpose of checking out a VA LCD, 1800  curved display panel. This is the first time I have used this type of monitor. I am very satisfied with the picture quality. This monitor is excellent for watching movies and good enough for office work even though it is only has 1080 resolution. I find that the 27 Inch curved panel is less of a strain on your vision than a flat panel.  I am not aware of any distortion due to the curve. This monitor is well suited to general purpose use. The only complaint I have about the monitor I received is that at the time I ordered the monitor, the specification described it featured HDMI and DisplayPort. However, the item I received had HDMI and VGA. If I had seen the VGA specification I probably would NOT have ordered this monitor. I noticed that, as of today, the posted specification does show HDMI / VGA but at a discounted price, which is still a good value. Anyway, I am still happy with just using HDMI since I do not plan to use it much for Gaming, which really does need the DisplayPort video for best operation. Update to my Review: The Seller has provided me with a REFUND which will take my payment down to the discounted price. The Seller apologized for my inconvenience. So, 5 stars to the Seller.",Good value with one limitation,"Reviewed in the United States on August 19, 2022",True,4.0
B09P7ZK4CJ,,Great budget monitor!,"Reviewed in the United States on March 12, 2023",True,5.0
B09P7ZK4CJ,You won’t be upset by your choice.,Great budget monitor.,"Reviewed in the United States on February 1, 2023",True,4.0
B09P7ZK4CJ,"Got this screen becaues,it was on sale,and i dont regret,the thing i do regert is throwing away a brand new hdmi cable the one that came in the box to be excat. i forgot to turn off the screen the third day i got the screen didnt think much of it till i tried to turn on my pc the hdmi gave out im guessing no biggy i just switch the old one i was planning to used but after a while i did notice that for some reason the screen now on boot up have a like fan reving up sound that it did not make becuease its noticeable till its adjustes but i digress at the end of the day a very good looking screen.","Its an amazing screen, But..","Reviewed in the United States on November 6, 2022",True,4.0
B09P7ZK4CJ,this monitor is very nice!,great color,"Reviewed in the United States on January 31, 2023",True,4.0
B09P7ZK4CJ,I've had a few top of the line gaming monitors over the years. These monitors are awesome especially for the price. Definitely gonna buy there 27in 1440p monitor next.,Crua 24in,"Reviewed in the United States on February 17, 2023",True,5.0
B09P7ZK4CJ,"Go buy a better display port cables, I switched it for one I have laying around from a benQ monitor and now it's at 1080p 165hz",How to fix when the display is not 1080P,"Reviewed in the United States on January 11, 2023",True,4.0
B09P7ZK4CJ,I bought 2 for a dual monitor setup with a Mac laptop. It’s great! Unfortunately one is slightly taller than the other lol. But they look fantastic. Absolutely great for the price.,I bought 2,"Reviewed in the United States on February 13, 2023",True,5.0
B09P7ZK4CJ,"Work good for simple tasks, not too expensive have a Xbox and my work computer hooked up! Use it 10-12 hrs a day in a commercial environment, have had for 2 months so far so good! Looks good and has done every task I’ve thrown at them, not the best if your going to be strictly gaming monitors don’t have 4k and graphics are mediocre. Overall I am extremely happy with these monitors will update this review after 6 months!",Good monitors make me money!,"Reviewed in the United States on January 25, 2023",True,5.0
B09P7ZK4CJ,"Super deal for a 165 hertz monitor, picture is clear, color is on point and super affordable for budget gamers. I would have given 5 stars across the board but I just noticed it has a dead pixel in the middle of the screen which kind of sucks... otherwise everything is great.***I'm just an idiot, I had something on my screen and when I cleaned it off the green dot went away, so no dead pixels, 5 stars!",Great cheap monitor,"Reviewed in the United States on January 21, 2023",True,5.0
B09P7ZK4CJ,"I was pleasantly surprised by how nice this monitor is. I just bought a gaming PC and wanted to get a larger monitor (the smaller one Ive used for work didn’t have the best picture) but I didn’t have the money to get the type of higher end monitor I wanted. Decided to give this brand a try as I was looking for a curved monitor that was more budget friendly.The picture is solid, and I like that I didn’t have to do a lot of adjustments out of the box to make the picture work for me (and not destroy my retinas, lower brightness is my friend).I don’t really know how to describe it in technical terms, but my only negative that I can think of is to me this monitor isn’t as “vibrant” as I’d like. Compared to my TV, the screen is a little dull? It’s very hard to describe, because I do think the image quality is quite good (very impressed with it on the games I play, and it’s perfect for work), but I think it’s maybe the backlighting that’s not as bold as I’d like it to be? I do not think it detracts from the performance of the monitor, it just doesn’t pop as much as I’d like.I’m very happy with this monitor, took a gamble on a brand I was not familiar with and I’m quite impressed. I’ll recommend it to others looking for a great performing budget monitor.",Monitor is great for gaming and work,"Reviewed in the United States on November 6, 2022",True,5.0
B09P7ZK4CJ,Great monitor,Great monitor,"Reviewed in the United States on March 6, 2023",True,5.0
B09P7ZK4CJ,"Very pleased with the set I bought. The screen quality seems really nice and the monitors are very light weight. Just two minor complaints 1) the setting/power buttons are on the back so it’s a little hard to get to… 2) the power cord is pretty delicate and the plug is blocky. If you have two, you can’t plug both of the power cords next to eachother on a power strip. They won’t fit.Overall, I love the monitors themselves. They seem great quality for the price. Just the cord and setting/power buttons are a little inconvenient",Great price for a home office,"Reviewed in the United States on November 18, 2022",True,4.0
B09P7ZK4CJ,It’s 100% best first monitor I’ve gotten mySelf,Get it,"Reviewed in the United States on February 28, 2023",True,5.0
B09P7ZK4CJ,The speed it has is phenomenal. Never had such smooth gameplay at 165hz. It even came with dp or hdmi connection. To get the full effect you’ll want to use dp. I’m throughly impressed with how helpful it is gameplay wise.,Super clean and the best monitor I’ve owned,"Reviewed in the United States on February 2, 2023",True,5.0
B09P7ZK4CJ,It's a good monitor for work use or gaming. All around good monitor,Gaming Monitor,"Reviewed in the United States on February 21, 2023",True,5.0
B09P7ZK4CJ,"I bought two of their monitors the FHD and QHD 27"" screens. I am impressed. For the price point I'm not sure you can really do any better for a new monitor. They do exactly what I need. They're light weight, slim bezel (the QHD has a smaller bezel) and perfect for my dual monitor mount. I had some issues getting 165hz out of the FHD monitor using the Display Port and customer support has been amazingly responsive and helpful. It more than made up for the issue.",Amazing monitors for the price,"Reviewed in the United States on January 14, 2023",True,5.0
B09P7ZK4CJ,"Was a little worried after reading the negatives left.The monitor works great, perfect picture, perfect color. And very easy to set up.We are using the monitor cable not the HDMI cable.Refresh rate seems good, games display perfectly.",Works great,"Reviewed in the United States on December 26, 2022",True,4.0
B09P7ZK4CJ,graphics could be better overall get what you paid for and I like it looks good with my setup,Fps 120,"Reviewed in the United States on January 10, 2023",True,4.0
B09P7ZK4CJ,Love the curve gives the greatest color that pops from the tv,Tv,"Reviewed in the United States on February 20, 2023",True,5.0
B09P7ZK4CJ,This fit my needs perfectly for 1080p gaming and general desktop use.,Great for 1080p gaming,"Reviewed in the United States on February 22, 2023",True,5.0
B09P7ZK4CJ,Monitor was for my son and it seems to be a hit so far. He is enjoying it and seems to be a good value.,Nice monitor for the price!,"Reviewed in the United States on December 30, 2022",True,4.0
B09P7ZK4CJ,Picture quality feels like somthings missing bit for the price and size of the screen I'm in no way disappointed.,Worth it.,"Reviewed in the United States on January 2, 2023",True,4.0
B09P7ZK4CJ,better than expected!,excellent value,"Reviewed in the United States on February 20, 2023",True,5.0
B09P7ZK4CJ,Out of all the budget monitors I have gotten this has to be the best deal you can get I wasn’t expecting much but damn I’m impressed,Best budget monitor,"Reviewed in the United States on February 4, 2023",True,5.0
B09P7ZK4CJ,Both screens are awesome. For some reason one screen is taller than the other. Even on the stand they provide it was taller than the other one. I bought a dual screen stand and still same problem. Still good quality just my only complaint.,Not bad,"Reviewed in the United States on November 27, 2022",True,4.0
B09P7ZK4CJ,I bought this monitor for work so I can have dual monitors. This monitor was affordable and is perfect for what I want it to do! Would recommend again!,Does what I need it to.,"Reviewed in the United States on January 30, 2023",True,5.0
B09P7ZK4CJ,"Waited a couple weeks to review this incase something went bad. But here we are, the 1 month mark, and the monitor is still standing good. the monitor itself is alright, the resolution is pretty crisp and bright, although I wish it had a manual adjustment instead of pre-lit settings because sometimes it can get TOO bright.  It doesnt support 165hz on everything but for my desktop it only supported 165hz. The stand for the monitor kind of sucks, i might have gotten a faulty one but it never snapped in place and the monitor itself almost fell the first time i stood it up on its own, leading me to have to put tape behind it which ruins the look if you look from the back. Other than that, its alright.",Good monitor for the price. But...,"Reviewed in the United States on January 18, 2023",True,3.0
B09P7ZK4CJ,I recently got this monitor so it’s extremely new still but what I have seen is that the screen quality isn’t that bad. I used it for my Mac book pro and my ps5 and so far it’s passable nothing too fancy but it will do. If you are used to great quality 4K screens maybe pay a little more but for what I need this screen for is perfect within the quality however…. I am extremely upset and feel very displeased that they state this is a 27 inch screen when in fact it is not. I personally measured it and it’s actually 24 inches. Knowing that this is a curved screen I measured the curved front and back and it always concluded to 24 inches idk if there was a mis print or maybe I was sent the wrong screen but it is in fact a 24in. I personally feel if they are going to state that it is 27 it should stay true to that sale pitch if not please charge me the correct price please. I am in the middle of the debate to eithe return this monitor or to keep it. But that few inches really makes a difference and I personally feel it’s incorrect to have another price for something it’s not true to.,Not a 27in monitor,"Reviewed in the United States on November 6, 2022",True,3.0
B09P7ZK4CJ,"I like this monitor, but the only really downside is that when I’m watching a movie or gaming and there’s a scene when the image is all black you can see the burn in white sploshes. Not too bad, but kinda disappointing to see.",Great monitor,"Reviewed in the United States on November 25, 2022",True,4.0
B09P7ZK4CJ,"Monitors came at a very fast pace, only particular issue with product is that it shipped with incorrect vesa mount screws so me and my father had to get creative and use wall socket mount screws instead so 4 stars instead of 5 for the inconvenience.",Fast shipping but beware of incorrect parts,"Reviewed in the United States on November 22, 2022",True,4.0
B09P7ZK4CJ,"The media could not be loaded.
                
            
                
            
            
        
    
    








  
  
     Ive seen other reviews showing that it was bad but they just got a faulty monitor cause mine has worked perfectly and love it so far",Worth the money and great quality and easy to set up,"Reviewed in the United States on March 12, 2023",True,5.0
B09P7ZK4CJ,The monitor looks and works pretty great. Only thing is I wish it had a built in speaker,Looks great,"Reviewed in the United States 🇺🇸 on December 4, 2022",True,4.0
B09P7ZK4CJ,I bought this moniter to go with my xbox series S and it works pretty well. I had a few downsides that could have been my fault but overall it was a good deals for an on sale moniter.,Good for a starting moniter,"Reviewed in the United States 🇺🇸 on November 15, 2022",True,4.0
B09P7ZK4CJ,"The media could not be loaded.
                
            
                
            
            
        
    
    








  
  
     Looks great and works great. The 144hz/165HZ really makes a difference while gaming. The color looks good and overall it's a phenomenal screen. Thin sleek design makes the setup really work. The curved design vs the non curved on the left is actually insanely versatile as well",Fantastic monitor,"Reviewed in the United States 🇺🇸 on February 24, 2023",True,5.0
B09P7ZK4CJ,Great for the next gen consoles. Do not second guess this product.,Amazing,"Reviewed in the United States 🇺🇸 on February 7, 2023",True,5.0
B09P7ZK4CJ,The hz on this monitor is amazing for its price,Worth it,"Reviewed in the United States 🇺🇸 on February 7, 2023",True,5.0
B09P7ZK4CJ,I did not know I got two but it's an good shape and it works well,Good,"Reviewed in the United States 🇺🇸 on February 2, 2023",True,5.0
B09P7ZK4CJ,My rig utilizes a 2 monitor setup.  Color was different between the 2 monitors and brightness was also drastically different.  With the monitors being side by side it differences seriously showed up.  Tired changing the DP cables also also tried with a different GPU results were the same.,Color not duplicated between monitors,"Reviewed in the United States 🇺🇸 on February 20, 2023",True,3.0
B09P7ZK4CJ,"Honestly a really good screen, thought the price was fair",Beautiful display,"Reviewed in the United States 🇺🇸 on February 6, 2023",True,5.0
B09P7ZK4CJ,looks good and has all the right specs but is Extremely dim 260 nits isn't bright enough unless your blacking out your room if they just made it a little brighter that would be nice.,Its really not bright enough,"Reviewed in the United States 🇺🇸 on February 27, 2023",True,3.0
B09P7ZK4CJ,I could've misinterpreted the description. I added 2 of these in my cart and realize I have 2 different monitors. They look the same until your attempt to active certain settings such as HDR. You can see from the photos this monitor is 2 different heights and model numbers. I couldn't figure out why the settings were off until a friend help point it out. Disappointing and now I'm stuck with them.....but would not be an issue if they were both the same.,2 of a kind,"Reviewed in the United States 🇺🇸 on January 22, 2023",True,3.0
B09P7ZK4CJ,"To the point:1) This monitor turns off and disconnects from my PC, as in, windows cannot detect that the monitor is still there. This causes all windows open in this monitor to be shoved to another.2) It has issues with dark mode apps moving. Specifically, any of the windows settings. When you drag the window around the text and icons seem to fade out.",few minor annoyances,"Reviewed in the United States 🇺🇸 on February 4, 2023",True,3.0
B09P7ZK4CJ,Monitor on the right. Super bright even at half brightness. Lightweight and looks great. Used for work.,Home office,"Reviewed in the United States 🇺🇸 on January 29, 2023",True,5.0
B09P7ZK4CJ,"The media could not be loaded.
                
            
                
            
            
        
    
    








  
  
     These are good monitors BUT you can only run 120hz with a hdmi cable and 780p with dp cable. They are not out right with this and it's very frustrating.  If you want more then 120 HZ don't buy this monitor!Update!I’ve ordered 4 of these they have sent 3 different models of the monitor 1 can’t run 144 or 165 another one works perfect and the third version flashes bright colors when you put your computer to sleep. It is very inconsistent.",YOU CAN'T RUN 144HZ OR 165HZ WHILE USING 1080P!,"Reviewed in the United States 🇺🇸 on February 7, 2023",True,3.0
B09P7ZK4CJ,"I have had this monitor for roughly 4 months. It has great picture quality. I don't use it for gaming. However, I have streamed on it. (I have high speed internet.) I thought it was perfect.",Love this.,"Reviewed in the United States 🇺🇸 on January 15, 2023",True,5.0
B09P7ZK4CJ,"Honestly, we didn't expect much because we had never heard of the brand. We got it for one of our kids for gaming as a Christmas gift. Much to our surprise it is excellent quality. No issues so far, great picture, brightness is great, works perfect. Would definitely recommend.",Definitely recommend,"Reviewed in the United States 🇺🇸 on January 7, 2023",True,5.0
B09P7ZK4CJ,"the resfresh rate isnt as advertised, I ordered a 1080p monitor thats 165hz, and i got a 1080p 120hz monitor, other than that it seems decent, not very curved though",Refresh rate isnt as rated,"Reviewed in the United States 🇺🇸 on February 20, 2023",True,3.0
B09P7ZK4CJ,"I bought the dual mount separately. The gameplay on these monitors is so smooth! I just upgraded from 60hz, and it is a very noticeable difference. Make sure to use the DP cable for 165hz. You’ll only get 120hz with the hdmi. I connected my speakers directly to the monitor and it sounds great. In the image I have my PC on one screen and my Xbox Series S on the other. They are curved, but it’s only slight.",Very good quality for price,"Reviewed in the United States 🇺🇸 on December 25, 2022",True,5.0
B09P7ZK4CJ,"Good monitor, haven’t had any problem. Was looking for an extra monitor and was able to find this affordable one with good quality image.",Good,"Reviewed in the United States 🇺🇸 on January 22, 2023",True,5.0
B09P7ZK4CJ,I bought this for my son's 15th birthday. It is perfect! The resolution is superb and is compatible with his PC.,Great buy!,"Reviewed in the United States 🇺🇸 on January 23, 2023",True,5.0
B09P7ZK4CJ,I received this monitor and set it up right away. I am using this for my work monitor. It is bright and easy to set up. I am highly impressed at the quality. I can now work with having four screens in view at one time. It is exactly what I wanted and the bonus was the price. Well worth every penny!!,AWESOME MONITOR!!!,"Reviewed in the United States 🇺🇸 on December 29, 2022",True,5.0
B09P7ZK4CJ,Got this for a family member and she loves it. Great Budget Gaming Monitor after a couple months of daily use.,Great Budget Gaming Monitor,"Reviewed in the United States 🇺🇸 on January 22, 2023",True,5.0
B09P7ZK4CJ,"i used it for a day and this happened i did not do anything to it, it glitches and just overall not good. If you’re gonna buy a monitor theres better version’s out there on amazon sadly i cant return because i already threw the box out",dont buy,"Reviewed in the United States 🇺🇸 on February 1, 2023",True,3.0
B09P7ZK4CJ,"When I first got it I was like, WOW IT LOOKS EXACTLY LIKE HOW IT LOOKED ON AMAZON! I turned it on and yeah it’s good don’t get me wrong, but the coloration seems faded and I don’t know how to fix it because there are no YouTube videos about the product.",It’s the Coloration,"Reviewed in the United States 🇺🇸 on January 29, 2023",True,3.0
B09P7ZK4CJ,"After clicking the Purchase button, I was anxious everyday until delivery worrying that the monitors will arrive broken. The seller sent a message assuring me of the monitors safety and that relieved some of the fear. Luckily they arrived intact, well packaged, and MORE. These screens are incredible. The detail, the 144hz, the brightness, all of it.6 Thumbs Up (i live near a reactor)",Highly Recommended,"Reviewed in the United States 🇺🇸 on December 25, 2022",True,5.0
B09P7ZK4CJ,Have had no complaints for the 14 year old on anything.  Doesn’t lag and has a great display.  Love the curve.  Great monitor for the price point.,Great Budget Monitor,"Reviewed in the United States 🇺🇸 on January 14, 2023",True,5.0
B09P7ZK4CJ,It's not that's bad of a gaming monitor and I enjoy using it. The only thing I don't like is how it says that it's 144hz but I'm only getting 120hz. Also I thought the picture display was going to be all the way to the edge but it doesn't. There is about a 5mm gap.,Decent gaming monitor,"Reviewed in the United States 🇺🇸 on January 22, 2023",True,3.0
B09P7ZK4CJ,"it is a good monitor, but the color is just off., and the gradients aren't that good.",the color is weird,"Reviewed in the United States 🇺🇸 on March 1, 2023",True,3.0
B09P7ZK4CJ,"I had to do an exchange since it arrived with a dead pixel, after grieving and holding the last funeral rites for said pixel, I initiated an exchange and the new one arrived working perfectly. Not a bad budget gaming monitor, but if you can afford one that is better then do it, great item if you can get this on sale.",Great customer support,"Reviewed in the United States 🇺🇸 on December 23, 2022",True,5.0
B09P7ZK4CJ,"Works great for ps5, I was able to get 120hz without hdmi 2.1",Great monitor,"Reviewed in the United States 🇺🇸 on January 27, 2023",True,5.0
B09P7ZK4CJ,"Even though the monitor is quite good for this price, however there were some problems like the tilting. Not just me but a lot of people have their monitor tilting down to the ground and can’t even adjust the screen to what they desire at all. I think because something is jammed in it. But overall it’s pretty good",Tilting problem,"Reviewed in the United States 🇺🇸 on September 28, 2022",True,4.0
