asin,text,title,location_and_date,verified,rating
B09P7ZK4CJ,This monitor has great quality and it sits well for posture and overall comfort while gaming.,"Great monitor, great quality.","Reviewed in the United States on August 23, 2022",True,5.0
B09P7ZK4CJ,FreeSync and speakers not working for me via the displayport or hdmi cable.,Disappointed,"Reviewed in the United States on January 27, 2023",True,2.0
B09P7ZK4CJ,Great monitor but doesn’t even come with the screws necessary to put it together!!!,Get your own hardware!!,"Reviewed in the United States on August 10, 2022",True,3.0
B09P7ZK4CJ,Recomiendo el monitor excelente imagen,Excelente producto llego antes del tiempo estimado,"Reviewed in the United States on September 26, 2022",True,5.0
B09P7ZK4CJ,"Was super excited to get this to use as a second monitor for discord, however when it arrived I was super quick to mount it on the monitor arm. Plugged in the DC adapter to the wall and then the HDMI to my video card. Turned on the PC and then went to turn on the monitor and nothing. No power. The standby led wouldn't even light. Now I know I took a risk on a 100$ curve display but I can't even tell if the picture is good quality or not as it doesn't even power on! Maybe the power cord is faulty or something? Super disappointed in the product.",Bought a monitor that doesn't power on.,"Reviewed in the United States on February 8, 2023",True,1.0
B09P7ZK4CJ,"Received a damaged product with a crack at the upper left corner of the screen. Reached out to customer service, and they refunded $16.05. Now I am left with a cracked screen and $16 and with a growing realization that I should stop experimenting and rather stick to established brands.I would have returned the product, but badly need a monitor for my WFH.Apart from the crack, the display quality and brightness are quite good, and you probably won't complain.",Received a broken screen,"Reviewed in the United States on September 20, 2022",True,2.0
B09P7ZK4CJ,"I don't know if I got a bad model or what but playing any FPS game with this thing was a nightmare, it felt like I was concussed permanently and made me feel ill. I'm surprised this weird motion blur isn't really mentioned anywhere by anyone, but I cannot recommend this thing for gaming. It looks great and for the price it would preform fine as a monitor for much slower activities but other than that, awful.",motion blur is nausea inducing,"Reviewed in the United States on March 17, 2023",True,1.0
B09P7ZK4CJ,Perfect if u don't want to buyexpensive monitors  they are good!,They are great!!! Good quality cheap!,"Reviewed in the United States on August 12, 2022",True,5.0
B09P7ZK4CJ,setup was easy picture quality is very good,Works Great,"Reviewed in the United States on August 28, 2022",True,5.0
B09P7ZK4CJ,"I rarely write reviews about amazon stuff. However, this one does piss me off. Already decided to return.Long story brief, this monitor claims it can be compatible with 165hz and 1080p resolution, however, the truth is it doesn't even have the driver for the PC to detect itself with a DP cable. I bought this for a good price, however, all the cheap ones have a more expensive cost. As a result, it takes me the whole fecking day to find out this monitor doesn't even work. I am even an expert in such kinds of electronics, what about the other people has less expertise about computers, monitors, and other stuff? Just don't buy it. Make your life easier.","Low price SCAM scam: Everybody should know electronics are not just hardware, software also matters","Reviewed in the United States on January 16, 2023",True,1.0
B09P7ZK4CJ,Good everything,Good,"Reviewed in the United States 🇺🇸 on September 21, 2022",True,5.0
B09P7ZK4CJ,Nice screen. Picture quality is there and it feels nicely built,Good for Price and Feels of quality,"Reviewed in the United States 🇺🇸 on August 11, 2022",True,5.0
B09P7ZK4CJ,The monitor works great great quality it came really fast great upgrade,It came fast and untouched,"Reviewed in the United States 🇺🇸 on August 6, 2022",True,5.0
B09P7ZK4CJ,I'm not sure I'm gonna keep it I've noticed quite a lot of screen glitching and by glitching I mean it looks like the whole screen will shift for a millisecond and it does it a lot literally like a glitch effect. Not high quality if you ask me. Luckily I bought it for a second screen but even that I'm not sure I would recommend this. Spend more money my sceptre has 0 issues. This crua sitting next to it will likely get returned...,Screen glitches/flashes,"Reviewed in the United States 🇺🇸 on February 16, 2023",True,1.0
B09P7ZK4CJ,The only down fall of the monitor is there’s no sound but overall the graphics is good,It’s cool,"Reviewed in the United States 🇺🇸 on May 29, 2022",True,3.0
B09P7ZK4CJ,"Saw this on a flash sale and it seems like a great price. Well is at a good price, but at what cost?Long story short, I have a Rlazer Blade 15, 2070Q. Package was delivered swiftly and when I pulled everything out of the box, it looked great. But 6 minutes hadn't passed into the boot up, connect to PC (via HDMI) and inputting monitor settings, that it died. As I was sitting there, not pressing any button or changing any setting, the screen suddenly started to turn greenish, then slowly faded to black. It never responded after that. Regardless if I had pressed any button or try any other new chords.I think it completely died on me right then and there. Oh well, thank God for returns. So take this review with a grain of salt.","Yikes, died 5mins into installation! :/","Reviewed in the United States 🇺🇸 on November 30, 2022",True,1.0
B09P7ZK4CJ,"For a plug n play monitor. The resolution is atrocious (640x480 standard), and you need to be fairly tech savvy to get monitor to work correctly... If you can... I still have yet to get my monitor to have a good resolution and I'm not impressed.",Garbage monitor,"Reviewed in the United States 🇺🇸 on March 24, 2023",True,1.0
B09P7ZK4CJ,Can not get display to 144hz using amd Radeon rx5500 xt,Will not display in 144hz using any display port,"Reviewed in the United States 🇺🇸 on December 28, 2022",True,2.0
B09P7ZK4CJ,"not happy with this.  the dp port was locked into 640x480 resolution and there was nothing I could do to change it.  i tried a new cable, then a new video card, and then a new computer.  nothing worked.  it works fine with a hdmi cable, but then my hertz are maxed at 120 rather than 165, which is why I bought this one.  i'd give it 3 stars because it works fine with the hdmi cable, except i had to spend $20 in new cables trying to figure out what was wrong with it.",faulty dp port,"Reviewed in the United States 🇺🇸 on January 15, 2023",True,1.0
B09P7ZK4CJ,There are no options to turn off overdrive it is extremely blurry and filled with ghosting do not waste ur money they dont even give a guide or help with the ghosting,Extremely Blurry,"Reviewed in the United States 🇺🇸 on November 8, 2022",True,2.0
B09P7ZK4CJ,This is a good quality monitor for the price and the customer service that comes with it is amazing,Good monitor with great customer service,"Reviewed in the United States on May 18, 2022",True,5.0
B09P7ZK4CJ,This is clearly a refurbished/used monitor. Beyond pissed off. Scratches on the screen and stickers were not attached to protective film (there was no protective layer) so the glue left residue on the screen. AVOID.,"No film over screen, damaged","Reviewed in the United States on March 21, 2023",True,1.0
B09P7ZK4CJ,"24"" curved monitor. Someone please tell me this is like a weird factory setting. 44 total dead pixels. Why is the barcode sticker on the screen itself? Obviously damaged when it was packaged. Shame","22 DOA pixels in a ""33"" pattern on both my monitors","Reviewed in the United States on March 19, 2023",True,1.0
B09P7ZK4CJ,"I love the quality of the picture and the curve, I use it for gaming and streaming and all around everything I do for my pc","This monitor is great, was skeptical at first but it’s been fantastic so far","Reviewed in the United States on March 21, 2022",True,5.0
B09P7ZK4CJ,"I LOVE this monitor! For the price, it is unbeatable! The graphics are amazing!",Amazing graphics!!,"Reviewed in the United States on May 24, 2022",True,5.0
B09P7ZK4CJ,"Bought it thinking it was a good deal and looked great when I opened up the packaging, but unfortunately the monitor would turn on and 3 seconds later would turn off. So I returned it to get an exchange surely the next monitor would work. But to my surprise got another faulty monitor, so I think I can safely say, never buying another product from Crua again 👍🏼",Garbage Product,"Reviewed in the United States on February 11, 2023",True,1.0
B09P7ZK4CJ,Ive never written a review but for this i have too. For one it came broken and two the colors on this monitor are absolutely horrible they. Washed out and all.,Do not buy this,"Reviewed in the United States on March 18, 2023",True,1.0
B09P7ZK4CJ,I bought two 165Hz monitors and I only get 50Hz when I play on my Xbox series S. I checked the monitor using my laptop and only shows 60Hz max. I have no other options. Smh. I’d give negative stars if I could. See attached photos.,Only 6OHz on monitor and only pulls 50Hz on Xbox,"Reviewed in the United States on February 25, 2023",True,1.0
B09P7ZK4CJ,It’s been great so far the screen is very clear. I definitely recommend this to others to buy.,Great monitor,"Reviewed in the United States on March 29, 2022",True,5.0
B09P7ZK4CJ,I got exactly what I paid for.  The monitor did not work straight out of the box :(.,Did not work straight out of the box :(,"Reviewed in the United States on March 20, 2023",True,1.0
B09P7ZK4CJ,"The monitor itself could be really good, if it didn't come damaged. It's a shame that the two times I bought from CRUA, I got a damaged monitor both times. The first time, I got a whole array of white lines running down the monitor, which happened within a day of use. CRUA processed a full refund. The second time, the monitor literally came damaged, with two lines running across the screen. CRUA didn't even bother processing a refund this time around, only telling me to consult Amazon customer service. My experience with CRUA was a complete waste of time, and I'll never buy from them again.Update:It has now been a month or so.The sticker that they stick DIRECTLY INTO THE SCREEN? Try to wipe it off, and the third pic happened. Terrible monitor.","A complete waste of time. Two monitors sent, both of them came damaged.","Reviewed in the United States on August 17, 2022",True,1.0
B09P7ZK4CJ,"My son wanted a new monitor for gaming and was so excited to get this. Only to discover that it didn't work! We tried everything we could think of and it just wouldn't power on. Very sad to have to send it back, got a refund. Ended up ordering a better one from Wla-Mart.","Did not work, no picture","Reviewed in the United States on January 17, 2023",True,1.0
B09P7ZK4CJ,"The freesync feature does not work properly with my Radeon graphics card.  The screen goes blank for a second or two at random intervals while I'm playing my favorite games, or watching a movie, or even reading my email.  I turn off freesync and the screen blanking goes away, but so does the picture quality.There is no blue light eye care as advertised.There's other things I don't like, but who cares, I just returned the monitor after a couple of days.",Screen blacks out,"Reviewed in the United States on December 3, 2022",True,1.0
B09P7ZK4CJ,well There is no sound coming out the monitor and it is not my pc so I am currently trying to figure that out.,The audio doesn't work,"Reviewed in the United States on September 23, 2022",True,2.0
B09P7ZK4CJ,The media could not be loaded.,Como configuro a 120 hz en mi ps5 alguien sabe tengo este monitor Crua,"Reviewed in the United States on July 10, 2022",True,5.0
B09P7ZK4CJ,"Loved this product until the power supply simply stopped working only after a few months. Would rate it 10/10 if not for three critical flaws:1) The screen protector leaves a bit of gunk at the bottom of the monitor after taking it off that's difficult to remove.2) In my experience doesn't work well with other power or HDMI cables3) Power cable stopped working after only a couple months, and of you see above I'm worried that getting a new one won't work with this monitor.","Great monitor, not that great of quality","Reviewed in the United States on November 2, 2022",True,1.0
B09P7ZK4CJ,"It just a waste of money, it doesn’t turn on anymore after two months.","This monitor is a waste of money, don’t waste your money….","Reviewed in the United States on March 19, 2023",True,1.0
B09P7ZK4CJ,"DP 165hz does not work so, I plugged in HDMI and all I got was 120hz. also even if you play low GPU-needed games you will see the blur in every movement. I would not recommend this monitor to anyone. The only good experience with this was the return policy by amazon.",some features do not work,"Reviewed in the United States on January 3, 2023",True,1.0
B09P7ZK4CJ,"The media could not be loaded.
                
            
                
            
            
        
    
    








  
  
     Set the monitor up the very first day I received it, played a little on my PS5. The next day when it was powered up there was major distortion in the screen.",It’s the MATRIX,"Reviewed in the United States on February 25, 2023",True,1.0
B09P7ZK4CJ,"I set up the base like the video said, plugged everything in and my monitor never came on 🤦🏾‍♂️",Monitor,"Reviewed in the United States on February 25, 2023",True,1.0
B09P7ZK4CJ,"I’m no tech expert but if refresh rate is described as Hz, this is 144Hz but the refresh rate is only 120…..I’m feeling I got ripped off. Got the same monitor a few years ago and it’s refresh rate is higher and th picture is much better. The new model is definitely no improvement. It’s worse.",Wrong description,"Reviewed in the United States on December 25, 2022",True,1.0
B09P7ZK4CJ,Just unboxed this monitor and setup. I got a red line right down the right side of screen,Nooooo,"Reviewed in the United States on February 15, 2023",True,1.0
B09P7ZK4CJ,would love to know why it came like this.,when the package arrived today everything looked fine but when i set it up it looked like this.,"Reviewed in the United States on March 15, 2023",True,1.0
B09P7ZK4CJ,The whole screen was pixelated and had streaks of color through it,I’ve ordered the monitor twice both times it was broken,"Reviewed in the United States on September 18, 2022",True,2.0
B09P7ZK4CJ,"None of my computers recognized this as a 144hz monitor, only 120hz. Monitor is insanely glossy and had visible scuffs on the top lining. Color uniformity is terrible and didn't look clean from any angle. Monitor had a pronounced blue tint on the edges. Included cabls are short. Stand is not adjustable and is quite short.",Look elsewhere,"Reviewed in the United States on December 6, 2022",True,1.0
B09P7ZK4CJ,i have ordered this 2 different times and both times it can broken,don't buy,"Reviewed in the United States on February 16, 2023",True,1.0
B09P7ZK4CJ,I ordered this expecting it to be fully 165hz as it was advertised and I was highly disappointed. What I wanted was a 165hz monitor and what I got was a monitor that could only push up to 120hz max. Why is this?,"This is a scam, not 165hz, its 120 max","Reviewed in the United States on December 9, 2022",True,1.0
B09P7ZK4CJ,"Monitor came with a dead pixel in the upper right corner, and the displayport they sent makes the monitor stuck in 1024x768 so I cant even use the full 165hz",Dead pixe;,"Reviewed in the United States on December 31, 2022",True,1.0
B09P7ZK4CJ,The monitor won’t turn on and it’s not broken and I did everything the instructions told me to do and it still haven’t turned on this would be a zero star right now but that’s not possible I spent all my money on a monitor that took six days to arrive and it gives me a monitor that won’t turn on I highly recommend not getting this,The monitor won’t turn on and it’s not broken,"Reviewed in the United States on October 29, 2022",True,1.0
B09P7ZK4CJ,Cheap garbage from a sweatshop in China somewhere.,Complete garbage,"Reviewed in the United States on February 1, 2023",True,1.0
B09P7ZK4CJ,my cursor ghosts when i move it around a dark background. really disappointed. don’t recommend.,too much ghosting on dark color,"Reviewed in the United States 🇺🇸 on January 13, 2023",True,1.0
B09P7ZK4CJ,I was away when this arrived.  I set it up and the quality is horrible.  There was a short window to return it now I am out of luck.,Do not buy ...,"Reviewed in the United States 🇺🇸 on November 25, 2022",True,1.0
B09P7ZK4CJ,The stand has no screws to monitor and it fell off worst buy ever,Back stand is broke,"Reviewed in the United States 🇺🇸 on December 25, 2022",True,1.0
B09P7ZK4CJ,"Very unhappy with this monitor. It came with a barcode sticker on the screen! I can't just peel it off either, it's really stuck on there and it has residue underneath it also. Wonderful. I should have returned it when I had the chance but got so busy with work that I missed the return window.  Super bummed.",Came with a barcode sticker on the screen,"Reviewed in the United States 🇺🇸 on August 18, 2022",True,1.0
B09P7ZK4CJ,"Bought it for my Xbox series s and idk how to turn on the 120 fps or wjy it isn’t automatically popping up someone please help me , also I feel like my monitor is tilted towards me a bit. Update , tried everything and it turns out this monitor is lying in the ads it ducks don’t recommend",Don’t know why they say 120 do’s when it can’t do that not evem close .,"Reviewed in the United States 🇺🇸 on August 19, 2022",True,1.0
B09P7ZK4CJ,"I used this display for about a week, worked awesome for first few days until it started flickering at random moments. I changed hdmi cable and problem continued and now it goes off and doesn’t come on until few minutes passed",Fantastic display when it works…,"Reviewed in the United States 🇺🇸 on September 19, 2022",True,1.0
B09P7ZK4CJ,Very gray picture quality. Images and text appear blurry. Not worth the money whatsoever. Have tried adjusting brightness and adjusting through NVIDIA settings but the issue is with the monitor itself. Spend a few extra dollars and just get an acer or HP. Left is CRUA. Right is HP.,You get what you pay for,"Reviewed in the United States 🇺🇸 on September 6, 2022",True,1.0
B09P7ZK4CJ,This is *NOT* an Ultra Wide. It is a STANDARD 16:9 Aspect Ratio. 1920x1080. Ultra wide would have been 2560x1080.,NOT ULTRAWIDE.,"Reviewed in the United States 🇺🇸 on December 1, 2022",True,1.0
B09P7ZK4CJ,No sound. Just terrible,No sound. Terrible,"Reviewed in the United States 🇺🇸 on January 10, 2023",True,1.0
B09P7ZK4CJ,This is awful don’t waste your money,This is totally not worth it at all,"Reviewed in the United States 🇺🇸 on December 30, 2022",True,1.0
B09P7ZK4CJ,Odd burn in splotches on the screen. Very upsetting!!!!,Splotchy McSplotches.,"Reviewed in the United States 🇺🇸 on May 26, 2022",True,2.0
B09P7ZK4CJ,HAD IT FOR 2 MONTHS ALREADY AND IS ALREADY GARBAGE,pixelating blurred,"Reviewed in the United States 🇺🇸 on December 20, 2022",True,1.0
B09P7ZK4CJ,,They send you a broke screen,"Reviewed in the United States 🇺🇸 on January 6, 2023",True,1.0
B09P7ZK4CJ,NO SOUND,DOES NOT PLAY SOUND WHEN HEADPHONES ARE PLUGGED INTO TH PC,"Reviewed in the United States 🇺🇸 on January 5, 2023",True,1.0
B09P7ZK4CJ,Very decent starter monitor. Does what it needs to.,It’s an ok monitor,"Reviewed in the United States 🇺🇸 on December 6, 2022",True,1.0
B09P7ZK4CJ,It is 120hz not 165 hz,Only 120 HZ,"Reviewed in the United States 🇺🇸 on December 7, 2022",True,1.0
B09P7ZK4CJ,"Received the monitor but on the screen you can see the film on the bottom,seems like its the film from the screen itself and not a protecting film.",Film on screen,"Reviewed in the United States 🇺🇸 on August 29, 2022",True,1.0
B09P7ZK4CJ,This piece of junk has the worst picture quality ever the whole screen in gray and green you cant even see red waste of money DO NOT BUY,Garbage,"Reviewed in the United States 🇺🇸 on August 23, 2022",True,1.0
B09P7ZK4CJ,Stand came broken !,Garbage,"Reviewed in the United States 🇺🇸 on December 3, 2022",True,1.0
B09P7ZK4CJ,It advertises the monitor as being 144hz/165hz refresh rate but in my advanced settings i can only select a maximum of 119? All this on top of being 5 days late with shipping. Might have to refund,False Advertising?,"Reviewed in the United States 🇺🇸 on July 6, 2022",True,1.0
B09P7ZK4CJ,Monitor goes black for days.,Horrible,"Reviewed in the United States 🇺🇸 on November 23, 2022",True,1.0
B09P7ZK4CJ,Monitor came broken,Broken on arrival,"Reviewed in the United States 🇺🇸 on November 17, 2022",True,1.0
B09P7ZK4CJ,"The media could not be loaded.
                
            
                
            
            
        
    
    








  
  
     One is fine the other flickers on and off every 5-10 seconds.  Hopefully the seller will contact me to replace",Flickers on & off. Not usable,"Reviewed in the United States 🇺🇸 on October 31, 2022",True,1.0
B09P7ZK4CJ,Es una basura no enciende El monitor es una gran estafa no ledoy ni media estreña,Nada,"Reviewed in the United States 🇺🇸 on September 8, 2022",True,1.0
B09P7ZK4CJ,I got it and half of the screen is broke been waiting on a refund for a weeks now,Broken,"Reviewed in the United States 🇺🇸 on August 17, 2022",True,1.0
B09P7ZK4CJ,pedestal screw was stripped when it came out of box -not satisfied at all with product,POORLY MADE PEDESTAL,"Reviewed in the United States 🇺🇸 on August 24, 2022",True,1.0
B09P7ZK4CJ,"I disliked everything...FALSE ADVERTISING!! NOTHING was correct, do not buy!!","Horrible,  false advertising!","Reviewed in the United States 🇺🇸 on September 14, 2022",True,1.0
B09P7ZK4CJ,We have had the monitor less than 2 months and it has completely stopped working.,Defective,"Reviewed in the United States 🇺🇸 on August 1, 2022",True,1.0
B09P7ZK4CJ,Product came two days late and the top right corner of the screen was cracked and peeling.,Late and Damaged,"Reviewed in the United States 🇺🇸 on July 26, 2022",True,1.0
B09P7ZK4CJ,"The media could not be loaded.
                
            
                
            
        
    
    








  
     No lo recomiendo",Nunca encendió prende y se apaga,"Reviewed in the United States 🇺🇸 on November 4, 2022",True,1.0
B09P7ZK4CJ,Screen glitches a lot for certain games,Gaming monitor,"Reviewed in the United States on December 29, 2022",False,3.0
B09P7ZK4CJ,"Very good, especially for the price",Good quality good price,"Reviewed in the United States on January 4, 2023",False,5.0
B09P7ZK4CJ,Is there anyway i can fix this? There is just a random black pixel on my screen and i’ve only had it for a week or so,Great monitor having a 1 issue with mine im not sure abt other people though,"Reviewed in the United States on September 4, 2022",False,4.0
B09P7ZK4CJ,"I got this in a pre-Black Friday deal for my son’s birthday. He loves it! Great resolution for gaming, nice size in his desk.",Great monitor,"Reviewed in the United States on November 23, 2022",False,5.0
B09P7ZK4CJ,Play cod on it and it looks awesome!,No complaints!,"Reviewed in the United States on November 9, 2022",False,5.0
B09P7ZK4CJ,"I bought a new cord to see if that was the issue, still having problems. I do not recommend this monitor. It was a huge waste of money for me.","Picture is fuzzy, monitor cuts out every 10 minutes","Reviewed in the United States on March 21, 2023",False,1.0
B09P7ZK4CJ,site says 144/165hz but it only goes 120hz scam :/,site says 144/165hz but it only goes 120hz scam :/,"Reviewed in the United States on September 21, 2022",False,3.0
B09P7ZK4CJ,i liked the resolution and the refresh rate just not the quality of screen,screen starts to develop dark spots,"Reviewed in the United States on March 8, 2023",False,1.0
B09P7ZK4CJ,"Straight out of the box this monitor was already broken. Top left side was broken, I noticed it when I finished setting it up. When I turned it on to see maybe if it would be okay like that, the whole screen shows cracks",Terrible,"Reviewed in the United States on March 3, 2023",False,1.0
B09P7ZK4CJ,It broke after a couple week,It broke after a couple week,"Reviewed in the United States on February 20, 2023",False,1.0
B09P7ZK4CJ,"This was a Christmas present to me, for it I enjoy it, but I know it was meant to be the 165hz model, instead it’s the 75hz. Unless there’s a way to have all the frames being used, it’s a blurry mess",Wrong model,"Reviewed in the United States on December 26, 2022",False,2.0
B09P7ZK4CJ,"I have spent an hour trying to put this thing together, but it won’t fit. The directions included have not helped at all in the set up. If you value your time, do not buy this product.",The stand is manufactured incorrectly…,"Reviewed in the United States on November 30, 2022",False,1.0
B09P7ZK4CJ,Easy to install. Great value. Great picture. High refresh rate,Great picture,"Reviewed in the United States on May 3, 2022",False,5.0
B09P7ZK4CJ,i felt bad that i got it DOA after waitng couple of days before opening it and got it returned with no problems or issues and got a replacement with ezz and idm it i sorta wished i got a 1440p monitor otherwise great monitor if you want 1080p gaming ITS OHH DANNNMM size btw lol,fantastic product and amazing support,"Reviewed in the United States on August 13, 2022",True,5.0
